Task Title,Skills
Develop voice recognition system for smart home devices,"Voice Recognition, AI, Machine Learning, Speech-to-Text, Python"
Implement serverless architecture for microservices,"Serverless, Microservices, AWS Lambda, Azure Functions"
Create real-time chat application for customer support,"Real-Time Communication, WebSockets, Node.js, JavaScript"
Design scalable database architecture for large datasets,"Database Architecture, SQL, NoSQL, Sharding, Data Partitioning"
Create CI/CD pipeline for automated software deployment,"CI/CD, Jenkins, GitLab, Docker, Kubernetes"
Perform security audit for web application,"Security Audit, Vulnerability Assessment, Penetration Testing, OWASP"
Develop automated testing framework for web app,"Test Automation, Selenium, Java, Testing Framework"
Build a PWA for offline access to web app,"Progressive Web App, JavaScript, Service Workers, HTML/CSS"
Integrate third-party API for weather forecasting,"API Integration, Weather API, JavaScript, Python, JSON"
Create a recommendation engine using collaborative filtering,"Recommendation Systems, Python, Collaborative Filtering, Data Analysis"
Migrate on-premise database to cloud-based solution,"Database Migration, AWS, Azure, Cloud, SQL"
Implement dark mode feature for mobile app,"UI/UX, Mobile Development, Android, iOS, Theming"
Build a serverless e-commerce platform,"Serverless, AWS Lambda, API Gateway, DynamoDB"
Develop facial recognition app for attendance tracking,"Facial Recognition, AI, Machine Learning, Python, OpenCV"
Create data visualization dashboard for business analytics,"Data Visualization, Power BI, Tableau, SQL"
Build a REST API for a microservice architecture,"REST API, Microservices, Java, Spring Boot, Docker"
Write integration tests for API endpoints,"Integration Testing, API, Postman, Java, Python"
Set up load balancer for high-traffic website,"Load Balancing, AWS, Nginx, Web Architecture"
Create voice assistant for smart home system,"Voice Assistant, AI, NLP, Python, Dialogflow"
Design UI for admin panel of web application,"UI/UX Design, Figma, HTML/CSS, JavaScript"
Implement data encryption for secure communication,"Data Encryption, Security, TLS, SSL, Backend"
Build a mobile app for real-time location tracking,"Mobile Development, GPS, Android, iOS, React Native"
Integrate machine learning model with web application,"Machine Learning, Python, Scikit-Learn, Flask, API"
Create script for automated log analysis,"Automation, Log Analysis, Python, Bash, Scripting"
Develop blockchain-based payment system,"Blockchain, Cryptocurrency, Solidity, Smart Contracts, Ethereum"
Build a custom CMS for managing blog content,"CMS, Web Development, PHP, WordPress, JavaScript"
Automate report generation for business intelligence,"Automation, BI, SQL, Python, Power BI"
Create a content recommendation system for news platform,"Recommendation Systems, AI, Machine Learning, Python"
Implement multi-language support for mobile app,"Localization, Android, iOS, Mobile Development, Internationalization"
Build a sentiment analysis tool for social media posts,"Sentiment Analysis, Natural Language Processing, Python, Text Mining"
Set up containerization for a microservices architecture,"Containerization, Docker, Kubernetes, Microservices, DevOps"
Implement load testing for web application,"Load Testing, Performance Testing, JMeter, API, Backend"
Create a video streaming platform with live chat,"Video Streaming, WebRTC, Node.js, JavaScript, Socket.io"
Develop mobile app for booking appointments,"Mobile Development, Swift, Android, Firebase, Booking System"
Build API for online booking system,"API, RESTful, JSON, JavaScript, Node.js"
Implement search functionality with filters and sorting,"Search Functionality, JavaScript, SQL, ElasticSearch"
Design a scalable architecture for IoT devices,"IoT, Cloud Architecture, AWS IoT, MQTT, Azure IoT"
Build a task scheduling system for cloud services,"Task Scheduling, AWS, Azure, Python, Cron"
Develop custom CRM system for sales tracking,"CRM, Web Development, PHP, MySQL, JavaScript"
Create recommendation system using user reviews,"Recommendation Systems, Collaborative Filtering, AI, Python"
Set up data pipelines for real-time data processing,"Data Pipelines, Kafka, Spark, Data Engineering, Python"
Develop login system,"Security, Backend, Authentication"
Design database schema,"Database, SQL, Design"
Implement REST API,"API, REST, Backend"
Create user interface,"UI, UX, Frontend"
Set up CI/CD pipeline,"CI/CD, DevOps, Automation"
Optimize application performance,"Performance, Optimization, Profiling"
Write unit tests,"Testing, Unit Tests, Quality Assurance"
Develop mobile app,"Mobile, iOS, Android"
Integrate third-party services,"Integration, Third-Party, API"
Implement caching strategy,"Caching, Performance, Backend"
Design microservices architecture,"Microservices, Architecture, Design"
Conduct code reviews,"Code Review, Quality Assurance, Best Practices"
Implement authentication and authorization,"Authentication, Authorization, Security"
Set up cloud infrastructure,"Cloud, Infrastructure, AWS"
Develop chat feature,"Chat, Real-Time, Communication"
Create data visualization dashboard,"Data Visualization, Dashboard, Frontend"
Implement payment gateway,"Payment Gateway, E-commerce, Integration"
Develop search functionality,"Search, Functionality, Backend"
Set up logging and monitoring,"Logging, Monitoring, DevOps"
Implement machine learning model,"Machine Learning, Model, AI"
Develop recommendation system,"Recommendation System, AI, Machine Learning"
Create automated testing framework,"Automated Testing, Framework, Quality Assurance"
Implement data encryption,"Data Encryption, Security, Backend"
Develop real-time notifications,"Real-Time, Notifications, Frontend"
Set up containerization with Docker,"Containerization, Docker, DevOps"
Create API documentation,"API, Documentation, Technical Writing"
Implement role-based access control,"Role-Based Access Control, Security, Backend"
Develop e-commerce platform,"E-commerce, Platform, Development"
Optimize database queries,"Database, Optimization, SQL"
Set up serverless functions,"Serverless, Functions, Cloud"
Develop social media integration,"Social Media, Integration, API"
Implement web scraping,"Web Scraping, Data Extraction, Backend"
Create multi-language support,"Multi-Language, Support, Localization"
Develop analytics platform,"Analytics, Platform, Data"
Set up load balancing,"Load Balancing, Infrastructure, DevOps"
Implement push notifications,"Push Notifications, Mobile, Frontend"
Develop video streaming feature,"Video Streaming, Feature, Media"
Create custom reporting tool,"Custom Reporting, Tool, Data"
Implement A/B testing,"A/B Testing, Experimentation, Frontend"
Develop IoT integration,"IoT, Integration, Development"
Set up VPN,"VPN, Security, Network"
Implement blockchain technology,"Blockchain, Technology, Development"
Develop chatbot,"Chatbot, AI, NLP"
Create voice recognition feature,"Voice Recognition, Feature, AI"
Implement facial recognition,"Facial Recognition, AI, Security"
Develop augmented reality feature,"Augmented Reality, Feature, Development"
Create virtual reality experience,"Virtual Reality, Experience, Development"
Implement geolocation services,"Geolocation, Services, Mobile"
Develop predictive analytics,"Predictive Analytics, Data, AI"
Set up data warehouse,"Data Warehouse, Storage, Backend"
Develop user login system with OAuth2,"OAuth2, Security, Authentication"
Design relational database schema for e-commerce,"Database Design, SQL, E-commerce"
Implement RESTful API for product management,"API, RESTful, Backend"
Create responsive user interface with React,"React, UI, Responsive Design"
Set up Jenkins CI/CD pipeline for automated testing,"CI/CD, Jenkins, Automation"
Optimize SQL queries for faster data retrieval,"SQL, Optimization, Performance"
Write unit tests for payment processing module,"Unit Testing, Payment Processing, Quality Assurance"
Develop cross-platform mobile app with Flutter,"Flutter, Mobile Development, Cross-Platform"
Integrate Stripe payment gateway,"Stripe, Payment Gateway, Integration"
Implement Redis caching for session management,"Redis, Caching, Session Management"
Design microservices architecture for order processing,"Microservices, Architecture, Order Processing"
Conduct code reviews for frontend components,"Code Review, Frontend, Best Practices"
Implement JWT authentication and role-based access control,"JWT, Authentication, Role-Based Access Control"
Set up AWS infrastructure with Terraform,"AWS, Infrastructure, Terraform"
Develop real-time chat feature using WebSockets,"WebSockets, Real-Time, Chat"
Create interactive data visualization dashboard with D3.js,"Data Visualization, D3.js, Dashboard"
Implement PayPal payment gateway integration,"PayPal, Payment Gateway, Integration"
Develop Elasticsearch-based search functionality,"Elasticsearch, Search, Backend"
Set up ELK stack for logging and monitoring,"ELK Stack, Logging, Monitoring"
Implement TensorFlow model for image classification,"TensorFlow, Machine Learning, Image Classification"
Develop collaborative filtering recommendation system,"Recommendation System, Collaborative Filtering, AI"
Create Selenium-based automated testing framework,"Selenium, Automated Testing, Framework"
Implement AES encryption for sensitive data,"AES, Encryption, Security"
Develop real-time notifications with Firebase,"Firebase, Real-Time, Notifications"
Set up Docker containers for microservices,"Docker, Containerization, Microservices"
Create Swagger API documentation,"Swagger, API, Documentation"
Implement role-based access control with Spring Security,"Spring Security, Role-Based Access Control, Security"
Develop Magento-based e-commerce platform,"Magento, E-commerce, Platform"
Optimize PostgreSQL database performance,"PostgreSQL, Optimization, Performance"
Set up AWS Lambda serverless functions,"AWS Lambda, Serverless, Cloud"
Develop social media login integration with Facebook and Google,"Social Media, Integration, OAuth"
Implement web scraping with BeautifulSoup and Scrapy,"Web Scraping, BeautifulSoup, Scrapy"
Create multi-language support with i18n,"i18n, Multi-Language, Localization"
Develop analytics platform with Apache Kafka,"Apache Kafka, Analytics, Data"
Set up Nginx load balancing for web servers,"Nginx, Load Balancing, Web Servers"
Implement push notifications for mobile app with Firebase Cloud Messaging,"Firebase Cloud Messaging, Push Notifications, Mobile"
Develop video streaming feature with HLS,"HLS, Video Streaming, Media"
Create custom reporting tool with JasperReports,"JasperReports, Reporting, Custom Tool"
Implement A/B testing with Optimizely,"A/B Testing, Optimizely, Experimentation"
Develop IoT device integration with MQTT,"MQTT, IoT, Integration"
Set up OpenVPN server for secure connections,"OpenVPN, Security, Network"
Implement Ethereum smart contracts with Solidity,"Ethereum, Smart Contracts, Solidity"
Develop chatbot with Dialogflow,"Dialogflow, Chatbot, AI"
Create voice recognition feature with Google Cloud Speech-to-Text,"Google Cloud Speech-to-Text, Voice Recognition, AI"
Implement facial recognition with OpenCV,"OpenCV, Facial Recognition, Security"
Develop augmented reality feature with ARKit,"ARKit, Augmented Reality, Development"
Create virtual reality experience with Unity,"Unity, Virtual Reality, Experience"
Implement geolocation services with Google Maps API,"Google Maps API, Geolocation, Mobile"
Develop predictive analytics model with scikit-learn,"scikit-learn, Predictive Analytics, Data"
Set up Redshift data warehouse for analytics,"Redshift, Data Warehouse, Analytics"
Optimize SQL queries for faster data retrieval,"SQL, Performance Optimization, Query Tuning"
Develop a chatbot for customer inquiries,"Chatbot, AI, Python, NLP"
Integrate OAuth for secure login,"OAuth, Security, Authentication, API"
Set up CI/CD pipeline for automated deployments,"CI/CD, Jenkins, Docker, DevOps"
Implement machine learning for spam detection,"Machine Learning, Spam Detection, Python"
Refactor legacy codebase for performance,"Code Refactoring, Performance, Clean Code"
Design RESTful API for e-commerce platform,"RESTful API, Backend, Node.js, JSON"
Create Docker container for microservices,"Docker, Containerization, Microservices"
Develop mobile app for restaurant reservations,"Mobile Development, Android, iOS, Java"
Build recommendation system for video content,"Recommendation Systems, Video Content, Machine Learning"
Automate backup of production databases,"Automation, Backup, Cloud, AWS"
Migrate on-premises infrastructure to AWS,"AWS, Infrastructure, Cloud Migration"
Develop real-time notification system,"Real-Time Notifications, Backend, JavaScript"
Create test cases for API endpoints,"API Testing, Postman, Python, Automation"
Design cloud architecture for fintech application,"Cloud Architecture, Fintech, AWS, Azure"
Implement JWT for secure session management,"JWT, Security, Backend, API"
Build serverless application for data processing,"Serverless, AWS Lambda, Data Processing"
Develop ETL pipeline for data warehouse,"ETL, Data Warehousing, Python, SQL"
Implement caching to reduce server load,"Caching, Redis, Server Load"
Build a voice assistant for smart home devices,"Voice Assistant, AI, Machine Learning, Python"
Set up load balancing for high-traffic web applications,"Load Balancing, AWS, Nginx, High-Traffic"
Design data encryption for sensitive user information,"Data Encryption, Security, TLS, SSL"
Create responsive UI for mobile and desktop users,"Responsive Design, UI/UX, HTML/CSS, Frontend"
Develop PWA for offline access,"PWA, Offline Access, JavaScript, Service Workers"
Create user authentication with two-factor authentication,"Two-Factor Authentication, Security, Backend, Python"
Implement logging and monitoring for microservices,"Logging, Monitoring, Microservices, DevOps"
Develop web scraper for e-commerce data extraction,"Web Scraping, E-Commerce, Python, BeautifulSoup"
Create mobile app for real-time GPS tracking,"GPS Tracking, Mobile Development, React Native, Android"
Integrate third-party API for email notifications,"API Integration, Email Notifications, JSON, Node.js"
Build a chatbot using natural language processing,"NLP, Chatbot, AI, Python, Rasa"
Optimize web application for SEO,"SEO, Web Optimization, HTML, Google Analytics"
Migrate legacy system to microservices architecture,"Microservices, Architecture, Migration, Docker"
Build a multi-tenant SaaS platform,"SaaS, Multi-Tenancy, Cloud, Web Development"
Create interactive data visualizations using D3.js,"Data Visualization, D3.js, JavaScript, HTML/CSS"
Develop blockchain-based voting system,"Blockchain, Voting System, Security, Solidity"
Implement sentiment analysis for social media monitoring,"Sentiment Analysis, Social Media, AI, Python"
Set up disaster recovery for cloud infrastructure,"Disaster Recovery, Cloud, AWS, Azure"
Build a chatbot for internal employee communication,"Chatbot, Internal Communications, AI, Python"
Implement geolocation features in mobile app,"Geolocation, Mobile Development, GPS, Android"
Develop a content management system for blogs,"CMS, Blog Management, Web Development, PHP"
Create a recommendation engine for product suggestions,"Recommendation Systems, AI, Python, Machine Learning"
Implement push notifications for mobile apps,"Push Notifications, Mobile Development, Firebase, iOS"
Develop AI-powered image recognition tool,"Image Recognition, AI, Python, OpenCV"
Design responsive email templates for marketing campaigns,"Responsive Design, Email Templates, HTML, CSS"
Build an API gateway for microservices communication,"API Gateway, Microservices, Communication, Security"
Set up Kubernetes cluster for container orchestration,"Kubernetes, Docker, Orchestration, DevOps"
Develop event-driven architecture for real-time processing,"Event-Driven Architecture, Real-Time, Node.js, Kafka"
Implement OAuth2 for third-party integrations,"OAuth2, Security, API, Authentication"
Create automated deployment scripts with Ansible,"Ansible, DevOps, Automation, Deployment"
Develop microservice for processing payments,"Microservices, Payment Processing, API, C#"
Build a chat application with WebSockets,"WebSockets, Real-Time Communication, Chat Application, JavaScript"
Create a video streaming platform for online courses,"Video Streaming, Online Courses, WebRTC, Node.js"
Design scalable database architecture for large datasets,"Database Architecture, SQL, NoSQL, Sharding"
Develop a search engine for documents and media files,"Search Engine, Elasticsearch, Media Files, Indexing"
Implement SSO for multiple web applications,"SSO, Authentication, Security, OAuth"
Create a system for fraud detection using machine learning,"Fraud Detection, Machine Learning, Python, Data Science"
Set up an API gateway for secure communications,"API Gateway, Secure Communication, Microservices"
Implement real-time collaboration features for a web application,"Real-Time Collaboration, Web Application, Node.js, WebRTC"
Build a distributed file system for large data storage,"Distributed File System, Storage, Cloud, Hadoop"
Create a machine learning model for recommendation systems,"Recommendation Systems, Machine Learning, AI, Python"
Develop an IoT dashboard for smart devices,"IoT, Dashboard, Smart Devices, MQTT"
Set up multi-factor authentication for secure access,"Multi-Factor Authentication, Security, Backend, Python"
Create an AI-powered chatbot for HR services,"Chatbot, HR Services, AI, Python"
Implement data pipelines for real-time analytics,"Data Pipelines, Real-Time Analytics, Python, Kafka"
Build a CI/CD pipeline for mobile applications,"CI/CD, Mobile Applications, Jenkins, DevOps"
Set up SSL encryption for secure communication,"SSL, Encryption, Security, Network"
Create a serverless chatbot with AWS Lambda,"Serverless, AWS Lambda, Chatbot, Python"
Develop a mobile app for health tracking,"Mobile App, Health Tracking, React Native, iOS"
Build a recommendation engine for personalized content,"Recommendation Engine, Personalized Content, Machine Learning"
Create a machine learning model for customer churn prediction,"Customer Churn Prediction, Machine Learning, AI, Python"
Implement GDPR compliance for user data,"GDPR, User Data, Compliance, Security"
Develop an AI-powered personal finance assistant,"Personal Finance Assistant, AI, Python, Fintech"
Create a cloud-based CRM system for sales tracking,"CRM, Sales Tracking, Cloud, Web Development"
Build a cross-platform mobile app for fitness tracking,"Cross-Platform App, Fitness Tracking, Mobile Development"
Develop a machine learning model for demand forecasting,"Demand Forecasting, Machine Learning, AI, Python"
Implement OAuth for social media login,"OAuth, Social Media Login, Authentication, Security"
Create an AR-based shopping experience,"AR Shopping, Augmented Reality, Mobile Development, Unity"
Set up real-time analytics for e-commerce site,"Real-Time Analytics, E-Commerce, Data Science, Python"
Develop a microservice for processing credit card transactions,"Payment Processing, Microservices, API, Cloud"
Implement a REST API for user management,"User Management, REST API, Authentication, Backend"
Create a video conferencing platform with real-time chat,"Video Conferencing, Real-Time Chat, WebRTC, Node.js"
Set up an ELK stack for log monitoring,"ELK Stack, Log Monitoring, DevOps, ElasticSearch"
Develop a chatbot for healthcare services,"Chatbot, Healthcare Services, AI, Python"
Implement serverless functions for data processing,"Serverless Functions, AWS Lambda, Data Processing"
Create a recommendation engine for news articles,"Recommendation Engine, News Articles, AI, Python"
Develop a mobile app for task management,"Task Management, Mobile App, React Native, iOS"
Build a cloud-based inventory management system,"Inventory Management, Cloud, Web Development, SQL"
Set up a distributed database for high availability,"Distributed Database, High Availability, Cloud, NoSQL"
Create a machine learning model for image classification,"Image Classification, Machine Learning, AI, Python"
Develop a real-time bidding system for ads,"Real-Time Bidding, Ads, Machine Learning, AI"
Implement SSO for corporate applications,"SSO, Corporate Applications, Security, Authentication"
Build a web-based dashboard for IoT devices,"IoT, Dashboard, Web Development, MQTT"
Create a voice-controlled smart assistant,"Voice Assistant, AI, Smart Devices, Python"
Develop a web scraper for competitive price monitoring,"Web Scraper, Competitive Monitoring, Python, BeautifulSoup"
Set up autoscaling for cloud infrastructure,"Autoscaling, Cloud, AWS, GCP"
Implement machine learning for predictive maintenance,"Predictive Maintenance, Machine Learning, AI, Python"
Create a microservice for user notifications,"Notifications, Microservices, User Engagement, C#"
Develop a recommendation engine for job postings,"Recommendation Engine, Job Postings, Machine Learning"
Set up a cloud-based load balancer,"Load Balancer, Cloud, AWS, Networking"
Create a machine learning model for sentiment analysis,"Sentiment Analysis, Machine Learning, Python, AI"
Build a chatbot for restaurant reservations,"Restaurant Reservations, Chatbot, AI, NLP"
Create a data pipeline for real-time streaming analytics,"Data Pipeline, Streaming Analytics, Python, Kafka"
Implement OAuth2 for secure API access,"OAuth2, API, Authentication, Security"
Develop a web application for project management,"Project Management, Web Application, Collaboration, React"
Create an interactive map with geolocation data,"Geolocation, Map, Mobile App, Google Maps"
Implement machine learning for anomaly detection,"Anomaly Detection, Machine Learning, AI, Python"
Develop a recommendation system for personalized learning,"Personalized Learning, Recommendation Systems, AI, Python"
Set up cloud infrastructure for multi-region deployment,"Multi-Region Deployment, Cloud, AWS, GCP"
Build a serverless app for weather forecasting,"Weather Forecasting, Serverless App, AWS Lambda, Python"
Create a microservice for handling payments,"Payments, Microservices, API, C#"
Implement two-factor authentication for user login,"Two-Factor Authentication, Security, Login, OAuth"
Develop a mobile app for e-learning,"E-Learning, Mobile App, Education, React Native"
Build a recommendation engine for online shopping,"Recommendation Engine, Online Shopping, Machine Learning"
Create a chatbot for travel booking,"Travel Booking, Chatbot, AI, NLP"
Set up a cloud-based messaging system,"Cloud Messaging, Real-Time Communication, Firebase, JavaScript"
Develop a machine learning model for fraud detection,"Fraud Detection, Machine Learning, AI, Python"
Create a web scraper for collecting product reviews,"Web Scraper, Product Reviews, Python, Scrapy"
Implement machine learning for customer segmentation,"Customer Segmentation, Machine Learning, AI, Python"
Build a serverless app for social media analytics,"Social Media Analytics, Serverless, AWS Lambda, Python"
Create a chatbot for real-time customer support,"Real-Time Customer Support, Chatbot, AI, NLP"
Set up an automated email notification system,"Automated Email, Notifications, Python, SMTP"
Develop a web app for collaborative document editing,"Collaborative Document Editing, Web Application, Real-Time"
Create a machine learning model for predicting stock prices,"Stock Prices, Machine Learning, AI, Python"
Build a cross-platform mobile app for personal finance,"Personal Finance, Cross-Platform App, Mobile Development"
Develop a real-time location tracking app,"Location Tracking, Real-Time, GPS, Android"
Set up cloud-based serverless functions for data processing,"Serverless Functions, Cloud, AWS Lambda, Python"
Create a machine learning model for personalized recommendations,"Personalized Recommendations, Machine Learning, AI, Python"
Develop a mobile app for real-time weather updates,"Weather Updates, Mobile App, Real-Time, React Native"
Implement facial recognition for secure access,"Facial Recognition, Security, AI, Python"
Build a recommendation system for movie suggestions,"Movie Suggestions, Recommendation System, Machine Learning"
Create an interactive dashboard for business analytics,"Business Analytics, Interactive Dashboard, Data Visualization, D3.js"
Set up continuous integration for automated testing,"Continuous Integration, Automated Testing, Jenkins, DevOps"
Develop a chatbot for order tracking,"Order Tracking, Chatbot, AI, NLP"
Implement machine learning for product categorization,"Product Categorization, Machine Learning, AI, Python"
Build a recommendation engine for personalized ads,"Personalized Ads, Recommendation Engine, AI, Machine Learning"
Create a web-based tool for visualizing data analytics,"Data Analytics, Visualization, Web-Based Tool, Python"
Set up real-time monitoring for cloud infrastructure,"Real-Time Monitoring, Cloud Infrastructure, AWS, DevOps"
Develop a mobile app for tracking fitness goals,"Fitness Tracking, Mobile App, Health, React Native"
Create a machine learning model for language translation,"Language Translation, Machine Learning, AI, Python"
Build a recommendation system for personalized emails,"Personalized Emails, Recommendation Systems, AI, Python"
