Task Title,Skills
Develop login system,"Security, Backend, Authentication"
Design database schema,"Database, SQL, Design"
Fix UI bugs,"UI, Frontend, JavaScript"
Implement REST API,"Backend, API, REST"
Write unit tests,"Testing, Backend, Unit Tests"
Optimize database performance,"Database, Optimization, SQL"
Setup CI/CD pipeline,"CI/CD, Automation, DevOps"
Design landing page,"UI/UX, Frontend, Design"
Deploy application on cloud,"Cloud, Deployment, DevOps"
Implement OAuth authentication,"Security, Authentication, OAuth"
Migrate legacy codebase to new framework,"Refactoring, Frameworks, Software Engineering"
Debug API issues,"API, Debugging, Backend"
Develop microservices architecture,"Microservices, Architecture, Backend"
Write integration tests,"Testing, Integration, Backend"
Create data visualization dashboard,"Data Visualization, Dashboard, Frontend"
Develop mobile app with Flutter,"Mobile Development, Flutter, UI"
Configure load balancing for app,"Load Balancing, Infrastructure, Cloud"
Implement machine learning model,"Machine Learning, Data Science, AI"
Build responsive web design,"Frontend, UI/UX, Design"
Create RESTful services with Node.js,"Node.js, RESTful, Backend"
Optimize server response time,"Server Optimization, Backend, Performance"
Develop chatbot using NLP,"Chatbot, NLP, AI"
Setup Docker environment,"Docker, Containerization, DevOps"
Design scalable cloud architecture,"Cloud, Scalability, Architecture"
Develop e-commerce platform,"E-commerce, Backend, Full-stack"
Fix cross-browser compatibility issues,"Frontend, Cross-browser, JavaScript"
Write backend services in Python,"Python, Backend, Services"
Develop data analytics pipeline,"Data Analytics, Backend, Pipeline"
Configure Kubernetes clusters,"Kubernetes, DevOps, Cloud"
Build event-driven architecture,"Event-driven, Backend, Architecture"
Setup monitoring and alerting,"Monitoring, DevOps, Infrastructure"
Implement user authentication with JWT,"Security, Authentication, JWT"
Create multi-language support for web app,"Localization, Frontend, Web Development"
Develop unit tests for frontend,"Frontend, Testing, Unit Tests"
Design microservices for distributed systems,"Microservices, Distributed Systems, Architecture"
Implement caching strategy for API,"API, Caching, Performance"
Create interactive data visualizations,"Data Visualization, Frontend, Charts"
Develop game engine for 3D games,"Game Development, 3D, Graphics"
Automate testing using Selenium,"Automation, Testing, Selenium"
Build API gateway for microservices,"Microservices, API Gateway, Backend"
Write SQL queries for complex data analysis,"SQL, Data Analysis, Queries"
Optimize frontend performance,"Frontend, Performance, Optimization"
Create CI/CD pipeline with Jenkins,"CI/CD, Jenkins, DevOps"
Develop serverless functions,"Serverless, Cloud, Backend"
Write Python scripts for data ETL,"Python, ETL, Data Engineering"
Implement OAuth2 authorization,"Security, OAuth2, Authorization"
Create chat app using WebSocket,"WebSocket, Real-time, Chat"
Fix memory leaks in large application,"Memory Management, Debugging, Performance"
Develop real-time chat system,"Chat, WebSocket, Real-time"
Setup application load testing,"Load Testing, Performance, Automation"
Implement social media sharing,"Social Media, API, Integration"
Optimize image loading for web,"Optimization, Images, Frontend"
Create user roles and permissions,"Security, Roles, Permissions"
Write end-to-end tests,"Testing, End-to-End, Automation"
Develop AR application,"AR, Mobile, 3D"
Configure database backup system,"Database, Backup, SQL"
Build data processing pipeline,"Data Engineering, ETL, Pipeline"
Implement file upload functionality,"File Upload, Backend, Frontend"
Create reusable UI components,"UI/UX, Frontend, Components"
Develop email notification system,"Backend, Email, Notifications"
Setup cloud-based logging,"Logging, Cloud, Monitoring"
Create multi-tenant architecture,"Multi-tenant, Architecture, Backend"
Automate build and deployment,"CI/CD, Automation, Deployment"
Design reporting dashboard,"Data Visualization, Reporting, Dashboard"
Develop voice recognition app,"Voice Recognition, AI, Mobile"
Setup serverless database,"Serverless, Database, Cloud"
Implement GraphQL API,"GraphQL, API, Backend"
Write code documentation,"Documentation, Code, Writing"
Create authentication with SSO,"Security, Authentication, SSO"
Build IoT application architecture,"IoT, Architecture, Backend"
Optimize mobile app performance,"Mobile Performance, Optimization, App"
Develop payment gateway integration,"Payment Gateway, Integration, Backend"
Configure server monitoring system,"Monitoring, DevOps, Infrastructure"
Build AI-powered recommendation engine,"AI, Recommendation, Machine Learning"
Implement push notifications,"Notifications, Push, Mobile"
Design real-time collaboration features,"Collaboration, Real-time, Frontend"
Write API documentation,"API, Documentation, Writing"
Develop geolocation-based services,"Geolocation, Services, Backend"
Create AI-powered chatbot,"Chatbot, AI, Natural Language Processing"
Write scripts for data migration,"Data Migration, Scripting, Automation"
Implement micro-frontend architecture,"Frontend, Microservices, Architecture"
Develop SaaS subscription model,"SaaS, Subscription, Backend"
Create custom analytics reports,"Analytics, Reporting, Custom"
Build serverless data pipeline,"Serverless, Data Pipeline, Cloud"
Develop containerized applications,"Containers, Docker, Kubernetes"
Setup real-time data streaming,"Real-time, Data Streaming, Architecture"
Develop NoSQL database design,"NoSQL, Database, Design"
Implement 3D rendering engine,"Rendering, 3D, Graphics"
Create advanced search functionality,"Search, Backend, Database"
Develop distributed file system,"Distributed Systems, File System, Architecture"
Setup data encryption,"Security, Encryption, Backend"
Design recommendation algorithms,"AI, Recommendation, Algorithms"
Build time-series data processing,"Data Processing, Time Series, Backend"
Implement password-less login,"Security, Login, Password-less"
Write Dockerfile for containerization,"Docker, Containerization, Backend"
Build AI-based image recognition,"AI, Image Recognition, Machine Learning"
Develop blockchain-based application,"Blockchain, Application, Development"
Create server-side rendering with React,"Server-side Rendering, React, Frontend"
Implement mobile app analytics,"Mobile Analytics, App, Backend"
Write scripts for automated testing,"Testing, Automation, Scripting"
Create API rate limiting,"API, Rate Limiting, Backend"
Develop NLP-based text classification,"NLP, Text Classification, AI"
Design modular software architecture,"Modular Architecture, Design, Software"
Implement real-time video processing,"Real-time Video, Processing, Streaming"
Build voice-controlled smart home system,"Voice Recognition, Smart Home, IoT"
Create sentiment analysis tool,"Sentiment Analysis, AI, Natural Language Processing"
Setup distributed caching system,"Caching, Distributed Systems, Backend"
Implement cloud cost optimization,"Cloud Optimization, Cost, Architecture"
Write Python scripts for data scraping,"Python, Data Scraping, Automation"
Develop AR/VR integration,"AR, VR, Integration, 3D"
Create API key management system,"API, Key Management, Security"
Build secure authentication workflows,"Authentication, Security, Workflows"
Develop cross-platform mobile app,"Mobile App, Cross-platform, Development"
Implement federated learning model,"Federated Learning, Machine Learning, AI"
Create cloud-native web application,"Cloud-native, Web Development, Backend"
Write Python scripts for web scraping,"Python, Web Scraping, Scripting"
Develop microservices for payment system,"Payments, Microservices, Backend"
Build scalable backend infrastructure,"Infrastructure, Scalability, Backend"
Create user journey mapping,"UX, User Journey, Mapping"
Design custom reporting tools,"Reporting, Custom Tools, Backend"
Develop hybrid mobile application,"Mobile, Hybrid, Development"
Implement WebSocket-based communication,"WebSocket, Real-time, Backend"
Create multi-user access control,"Access Control, Security, Backend"
Develop workflow automation tools,"Automation, Workflow, Tools"
Build cloud-based distributed systems,"Distributed Systems, Cloud, Backend"
Implement AI-based fraud detection,"AI, Fraud Detection, Machine Learning"
Create real-time user analytics,"Analytics, Real-time, User"
Write scripts for performance testing,"Performance Testing, Automation, Scripting"
Build recommendation system with ML,"Machine Learning, Recommendation, AI"
Implement dynamic content delivery,"Dynamic Content, Backend, API"
Create containerized microservices,"Microservices, Containers, Architecture"
Build data lake architecture,"Data Lake, Cloud, Architecture"
Develop real-time data visualization tools,"Data Visualization, Real-time, Backend"
Create mobile-first web app design,"Mobile-first, Web Development, UI/UX"
Setup serverless API gateway,"Serverless, API Gateway, Cloud"
Develop cloud automation scripts,"Cloud Automation, Scripts, Infrastructure"
Build streaming video service,"Streaming Video, Service, Backend"
Implement AI-based customer service,"Customer Service, AI, Machine Learning"
Write mobile app UI tests,"UI Testing, Mobile, Automation"
Implement OAuth2 authentication in web application,"OAuth2, Security, API, Backend, C#"
Optimize SQL queries for faster data retrieval,"SQL, Database Optimization, Performance Tuning, Indexing"
Build a custom file-sharing platform with encryption,"File Sharing, Encryption, Web Development, JavaScript, Python"
Implement real-time data synchronization between mobile devices,"Real-Time Data, Sync, Mobile Development, React Native, Firebase"
Create a web scraper to extract product data from e-commerce sites,"Web Scraping, Python, BeautifulSoup, Selenium, Data Mining"
Build a multi-tenant SaaS platform for project management,"SaaS, Multi-Tenant, Web Development, Node.js, MongoDB"
Develop mobile app for monitoring vitals from wearable devices,"Wearable Devices, Mobile Development, Android, iOS, Bluetooth"
Implement role-based access control (RBAC) for enterprise app,"RBAC, Security, Backend, Java, Spring Boot"
Build an event-driven architecture for handling real-time events,"Event-Driven Architecture, Kafka, RabbitMQ, Java, Microservices"
Create a dashboard for tracking energy consumption in smart homes,"IoT, Energy Monitoring, Dashboard, Web Development, Node.js"
Implement AI-based chat support for online services,"AI, Chatbot, Machine Learning, NLP, Python, TensorFlow"
Develop a content moderation system for social media platform,"Content Moderation, AI, Machine Learning, Python, Text Mining"
Automate email marketing campaigns based on user behavior,"Email Marketing, Automation, JavaScript, APIs, CRM"
Build a scalable video conferencing tool,"Video Conferencing, WebRTC, Node.js, JavaScript, Socket.io"
Create a real-time auction platform with bidding functionality,"Real-Time Bidding, Web Development, Node.js, Socket.io, JavaScript"
Implement deep learning model for image classification,"Deep Learning, Image Classification, Python, TensorFlow, Keras"
Build a serverless architecture for photo sharing platform,"Serverless, AWS Lambda, S3, API Gateway, DynamoDB"
Set up an ETL pipeline for processing big data,"ETL, Data Engineering, Big Data, Spark, Python, Hadoop"
Develop a custom e-learning platform for interactive courses,"E-Learning, Web Development, PHP, JavaScript, HTML/CSS"
Create a time-series forecasting model for stock prices,"Time-Series Analysis, Python, Machine Learning, Forecasting, Finance"
Build a decentralized application (dApp) on Ethereum,"dApp, Blockchain, Solidity, Ethereum, Smart Contracts"
Implement data lake architecture for large-scale data storage,"Data Lake, Big Data, AWS S3, Azure Data Lake, Data Engineering"
Create an AI-based text summarization tool for long articles,"AI, NLP, Text Summarization, Machine Learning, Python"
Develop a task management system for agile teams,"Task Management, Agile, Web Development, React, Node.js"
Build a predictive maintenance system for industrial equipment,"Predictive Maintenance, Machine Learning, IoT, Python, Data Science"
Implement continuous integration and deployment for mobile apps,"CI/CD, Jenkins, Android, iOS, Mobile Development"
Create a recommendation system for music streaming service,"Recommendation Systems, Collaborative Filtering, Machine Learning, Python"
Build a photo recognition app for identifying plant species,"Image Recognition, AI, Machine Learning, Python, TensorFlow"
Develop an API for sharing medical data securely,"API Development, Security, Healthcare, JSON, HIPAA Compliance"
Implement automated cloud cost optimization tool,"Cloud Cost Optimization, AWS, Azure, Automation, Python"
Build an interactive quiz platform with real-time scoring,"Quiz Platform, Web Development, JavaScript, Node.js, WebSockets"
Create a blockchain-based voting system for elections,"Blockchain, Voting System, Smart Contracts, Ethereum, Solidity"
Implement serverless video transcoding system,"Serverless, AWS Lambda, Video Transcoding, S3, FFMPEG"
Build a gamification system for employee training programs,"Gamification, Web Development, React, JavaScript, HTML/CSS"
Create a custom API gateway for managing microservices,"API Gateway, Microservices, RESTful, Node.js, AWS"
Develop a tool for automating database schema updates,"Database, Automation, Schema Updates, SQL, Liquibase"
Implement a zero-downtime deployment strategy for web apps,"Zero Downtime Deployment, Web Development, Docker, Kubernetes"
Create a collaborative whiteboard app for remote teams,"Collaborative Tools, Whiteboard, WebSockets, React, Node.js"
Build a cloud-based document storage system with version control,"Document Storage, Version Control, Cloud, AWS, Azure"
Develop a virtual reality (VR) app for architectural visualization,"VR, Architectural Visualization, Unity, 3D Modeling, C#"
Implement automated alerts for performance degradation in systems,"Performance Monitoring, Alerting, APM Tools, New Relic, Prometheus"
Build a social media platform for artists to showcase their work,"Social Media, Web Development, React, Node.js, MongoDB"
Create a text-to-speech engine for a mobile application,"Text-to-Speech, AI, NLP, Python, Mobile Development"
Develop a predictive analytics tool for customer churn,"Customer Churn, Machine Learning, Data Science, Python, Scikit-learn"
Build a tool for automating cloud infrastructure provisioning,"Cloud Infrastructure, Automation, Terraform, AWS, DevOps"
Create an augmented reality (AR) shopping experience for mobile,"Augmented Reality, AR, Mobile Development, Unity, iOS, Android"
Implement natural language processing for sentiment analysis of reviews,"NLP, Sentiment Analysis, Text Mining, Python, AI"
Build a custom blockchain for private enterprise use,"Blockchain, Private Networks, Enterprise, Hyperledger, Solidity"
Develop an AI-powered tool for detecting fraudulent transactions,"Fraud Detection, AI, Machine Learning, Python, Financial Services"
Create a secure video conferencing app with end-to-end encryption,"Video Conferencing, WebRTC, Node.js, JavaScript, Encryption"
Build a subscription-based content platform for creators,"Content Platform, Subscription, Web Development, JavaScript, HTML/CSS"
Implement real-time analytics dashboard for ecommerce,"Ecommerce, Analytics, Real-Time, Dashboard, JavaScript"
Build a mobile app for personal finance management,"Mobile Development, Personal Finance, Android, iOS, FinTech"
Create a fraud detection model using transaction data,"Fraud Detection, Machine Learning, Python, AI, Finance"
Develop an automated email alert system for system outages,"Email Alerts, Automation, Monitoring, Python, JavaScript"
Implement AI-based recommendation system for content personalization,"AI, Recommendation Systems, Machine Learning, Python, TensorFlow"
Build a mobile app for remote health monitoring,"Remote Health Monitoring, Mobile Development, IoT, Bluetooth"
Create a cloud-based video conferencing tool for education,"Video Conferencing, Education, WebRTC, Node.js, Socket.io"
Develop an AI model for predicting stock market trends,"Stock Market Prediction, AI, Machine Learning, Python, Data Science"
Build a microservice for handling user authentication,"Authentication, Microservices, OAuth, Node.js, MongoDB"
Create an event-driven architecture for order processing,"Event-Driven, Architecture, Order Processing, Kafka, Java"
Implement a chatbot for automating customer support queries,"Chatbot, Customer Support, AI, NLP, Python"
Build a tool for managing cloud resources across multiple providers,"Cloud Management, AWS, Azure, Terraform, Python"
Create a mobile app for managing home automation systems,"Home Automation, IoT, Mobile Development, Bluetooth, Android"
Develop a tool for automating cloud infrastructure security audits,"Cloud Security, Automation, Infrastructure, AWS, Python"
Build a system for real-time fraud detection in financial transactions,"Fraud Detection, AI, Financial Services, Machine Learning, Python"
Implement an AI-powered tool for automating resume screening,"Resume Screening, AI, Machine Learning, Python, TensorFlow"
Create a mobile app for tracking fitness activities,"Fitness App, Mobile Development, Android, iOS, HealthTech"
Build a predictive model for customer lifetime value,"Customer Lifetime Value, Machine Learning, Data Science, Python"
Develop an IoT-based system for remote environmental monitoring,"IoT, Environmental Monitoring, Cloud, AWS, Azure"
Implement automated testing for mobile apps,"Automated Testing, Mobile Apps, Selenium, Appium, JavaScript"
Create a marketplace platform for freelance services,"Freelance Marketplace, Web Development, React, Node.js, MongoDB"
Build an AI model for text classification in legal documents,"AI, Text Classification, Legal Tech, Machine Learning, Python"
Develop a machine learning model for spam detection in emails,"Spam Detection, Machine Learning, AI, NLP, Python"
Create a recommendation engine for online learning platforms,"Recommendation Systems, E-Learning, AI, Machine Learning, Python"
Build an AI chatbot for financial advice,"Chatbot, Financial Services, AI, NLP, Python"
Implement a DevOps pipeline for continuous deployment,"DevOps, CI/CD, Continuous Deployment, Jenkins, Docker"
Create a personalized news aggregation app,"News Aggregation, AI, Machine Learning, Python, NLP"
Build a computer vision system for detecting traffic violations,"Computer Vision, Traffic Violations, AI, Machine Learning, Python"
Develop a weather prediction system using machine learning,"Weather Prediction, Machine Learning, Python, Data Science"
Create a fitness tracker app with health insights,"Fitness Tracker, Health Insights, Mobile Development, Android, iOS"
Build a mobile payment application with blockchain integration,"Mobile Payments, Blockchain, Android, iOS, FinTech"
Develop a plagiarism detection tool for academic writing,"Plagiarism Detection, AI, Machine Learning, NLP, Python"
Create an AI tool for optimizing supply chain management,"Supply Chain, AI, Optimization, Machine Learning, Python"
Build a social network for job seekers with AI-powered job matching,"Social Network, Job Matching, AI, Machine Learning, Web Development"
Develop an AI-based recommendation system for healthcare treatments,"Healthcare, AI, Recommendation Systems, Machine Learning, Python"
Create a virtual assistant for scheduling and task management,"Virtual Assistant, Scheduling, AI, NLP, Python"
Build a fraud prevention system for online payments,"Fraud Prevention, Online Payments, AI, Machine Learning, Python"
Develop a voice recognition system for home automation,"Voice Recognition, AI, Home Automation, Python, Machine Learning"
Create a tool for monitoring cybersecurity threats in real time,"Cybersecurity, Threat Monitoring, AI, Python, Machine Learning"
Build an AI-based grading system for educational assessments,"AI, Education, Grading System, Machine Learning, Python"
Develop a smart contract system for real estate transactions,"Real Estate, Smart Contracts, Blockchain, Ethereum, Solidity"
Create an AI-based facial recognition system for security,"Facial Recognition, AI, Security, Python, OpenCV"
Build a platform for peer-to-peer lending with blockchain,"Peer-to-Peer Lending, Blockchain, FinTech, Smart Contracts, Solidity"
Develop a predictive analytics model for customer segmentation,"Customer Segmentation, AI, Predictive Analytics, Python"
Create an AI tool for optimizing online marketing campaigns,"AI, Marketing Campaigns, Optimization, Machine Learning, Python"
Build a secure communication app for business,"Secure Messaging, End-to-End Encryption, Web Development, JavaScript"
Develop a machine learning model for predicting election outcomes,"Elections, Machine Learning, AI, Predictive Analytics, Python"
Create an app for booking and managing coworking spaces,"Coworking Spaces, Mobile App, Booking, Android, iOS"
Build an AI-powered legal research tool for law firms,"Legal Tech, AI, Machine Learning, Legal Research, Python"
Develop a machine learning model for predicting stock prices,"Stock Market Prediction, Machine Learning, AI, Python, Data Science"
Create an automated system for processing insurance claims,"Insurance Claims, Automation, AI, Machine Learning, Python"
Build a knowledge management platform for enterprises,"Knowledge Management, Enterprise, AI, Machine Learning, Python"
Develop an AI model for detecting biased content in media,"Media Bias, AI, Machine Learning, NLP, Python"
Create an AI-based voice-to-text transcription tool,"Voice-to-Text, AI, NLP, Speech Recognition, Python"
Build a drone navigation system using machine learning,"Drone Navigation, AI, Machine Learning, Python, Computer Vision"
Develop a cloud-native application for inventory management,"Cloud-Native, Inventory Management, AWS, Azure, Python"
Create a mobile app for contactless payments using NFC,"Contactless Payments, NFC, Mobile Development, Android, iOS"
Build a personalized shopping assistant using machine learning,"Personalized Shopping, AI, Machine Learning, E-Commerce, Python"
Develop a tool for tracking and managing user data privacy preferences,"Data Privacy, User Preferences, GDPR, Automation, Python"
Create an AI-powered photo editing tool,"Photo Editing, AI, Image Processing, Machine Learning, Python"
Build a custom dashboard for visualizing IoT data,"IoT, Dashboard, Data Visualization, Web Development, Node.js"
Develop a smart home automation system with AI,"Smart Home, AI, IoT, Automation, Mobile Development"
Create a tool for automating compliance checks in the finance industry,"Finance, Compliance, Automation, AI, Machine Learning, Python"
Build a recommendation engine for personalized travel itineraries,"Travel Itineraries, AI, Recommendation Systems, Machine Learning"
Develop a mobile app for collaborative cooking and meal planning,"Collaborative Cooking, Meal Planning, Mobile Development, Android, iOS"
Create a custom machine learning model for facial expression analysis,"Facial Expression Analysis, AI, Machine Learning, Python"
Build an AI tool for detecting and preventing phishing attacks,"Phishing Detection, AI, Cybersecurity, Machine Learning, Python"
Develop a personalized fitness plan generator using AI,"Fitness Plan, AI, HealthTech, Machine Learning, Python"
Create an AI-powered scheduling assistant for remote teams,"Scheduling Assistant, AI, Remote Teams, NLP, Python"
Build an app for tracking and managing personal investments,"Investment Management, Mobile App, Android, iOS, FinTech"
Develop an AI-based system for predicting loan defaults,"Loan Defaults, AI, Machine Learning, Finance, Python"
Create a machine learning model for optimizing ad spend,"Ad Spend Optimization, Machine Learning, AI, Python, Marketing"
Build a secure messaging app with end-to-end encryption,"Messaging App, End-to-End Encryption, Mobile Development, Android, iOS"
Develop a voice-controlled app for hands-free note-taking,"Voice-Controlled App, Note-Taking, AI, NLP, Python"
Design user-friendly dashboard for ecommerce platform,"UI/UX, Figma, Frontend, JavaScript, HTML/CSS"
Develop mobile app for tracking workout routines,"Mobile Development, Swift, Android, iOS, Fitness APIs"
Integrate payment gateway in existing ecommerce app,"Payment Gateway, API Integration, C#, ASP.NET, Stripe"
Create machine learning model for predicting sales,"Machine Learning, Python, Scikit-Learn, Data Analysis"
Migrate legacy system to cloud-based infrastructure,"AWS, Azure, Cloud Architecture, Infrastructure Migration"
Implement caching to improve application speed,"Caching, Redis, API, Performance Optimization, Java"
Write unit tests for microservice architecture,"Unit Testing, Microservices, Java, JUnit, Test Automation"
Build a chatbot for customer support in website,"Chatbot, AI, Natural Language Processing, Python, Rasa"
Refactor codebase for better readability and maintainability,"Refactoring, Code Optimization, Clean Code, SOLID Principles"
Implement push notifications in mobile app,"Push Notifications, Android, iOS, Firebase, Mobile Development"
Create a real-time collaborative text editor,"WebSockets, Collaborative Editing, JavaScript, Node.js, WebRTC"
Develop recommendation engine for e-commerce site,"Recommendation Systems, Machine Learning, Python, Collaborative Filtering"
Implement two-factor authentication for login security,"Two-Factor Authentication, Security, Backend, Python, Flask"
Automate data backup to cloud storage,"Automation, Cloud Storage, AWS, S3, Python"
Build a responsive landing page for marketing campaign,"Responsive Design, HTML/CSS, JavaScript, Frontend"
Design API for data sharing between systems,"API Design, RESTful, OpenAPI, JSON, Postman"
Build an AR application for virtual home decor,"Augmented Reality, Unity, 3D Modeling, ARKit, ARCore"
